A1: ลำดับ | B1: รหัสประจำตัว | C1: ชื่อ-สกุล | D1: สาขา | E1: Midterm (105) | F1: Mid (30%)
A2: 1 | B2: 43221795 | C2: นายคงศักดิ์ อารยะธนิตกุล | D2: T04 | E2: 31.5 | F2: =E2*30/105 -> 9.00
A3: 2 | B3: 43222207 | C3: นายสถาพร โมลิสกุลมงคล | D3: T04 | E3: 94.5 | F3: =E3*30/105 -> 27.00
A4: 3 | B4: 44221497 | C4: นายกำพล หิสวาณิชย์ | D4: T04 | E4: 52.5 | F4: =E4*30/105 -> 15.00
A5: 4 | B5: 44221521 | C5: นายจักรินทร์ อินทรประสาท | D5: T04 | E5: 35 | F5: =E5*30/105 -> 10.00
A6: 5 | B6: 44221539 | C6: นายจาตุรนต์ จุฑาวิจิตร | D6: T04 | E6: 53.5 | F6: =E6*30/105 -> 15.285714285714286
A7: 6 | B7: 44221562 | C7: นายชัชวาลย์ ทรงยศ | D7: T04 | E7: 55 | F7: =E7*30/105 -> 15.714285714285714
A8: 7 | B8: 44221588 | C8: นายชัยฤทธิ์ โสภณอดิศัย | D8: T04 | E8: 68.5 | F8: =E8*30/105 -> 19.571428571428573
A9: 8 | B9: 44221646 | C9: นายธิติ ภูเจริญ | D9: T04 | E9: 50.5 | F9: =E9*30/105 -> 14.428571428571429
A10: 9 | B10: 44221703 | C10: นายนาวิน ศรีสองเมือง | D10: T04 | E10: 44 | F10: =E10*30/105 -> 12.571428571428571
A11: 10 | B11: 44221729 | C11: นายนิรุจน์ วันนิ | D11: T04 | E11: 71 | F11: =E11*30/105 -> 20.285714285714285
A12: 11 | B12: 44221737 | C12: นางสาวนุจรี มณีโชติ | D12: T04 | E12: 64.5 | F12: =E12*30/105 -> 18.428571428571427
A13: 12 | B13: 44221745 | C13: นายบดินทร์ บุญสรรค์ | D13: T04 | E13: 67.5 | F13: =E13*30/105 -> 19.285714285714285
A14: 13 | B14: 44221786 | C14: นายประวุฒิ สุขวาณิชย์ศิลป์ | D14: T04 | E14: 44 | F14: =E14*30/105 -> 12.571428571428571
A15: 14 | B15: 44221828 | C15: นางสาวพัชรี ธัญกานต์สกุล | D15: T04 | E15: 51.5 | F15: =E15*30/105 -> 14.714285714285714
A16: 15 | B16: 44221885 | C16: นางสาววาสนา อินทะพิมพ์ | D16: T04 | E16: 42 | F16: =E16*30/105 -> 12.00
A17: 16 | B17: 44221919 | C17: นายศราวุฒิ โพธิ์จันทร์ | D17: T04 | E17: 53 | F17: =E17*30/105 -> 15.142857142857142
A18: 17 | B18: 44221935 | C18: นายสัญญา โอ่งเจริญ | D18: T04 | E18: 56.5 | F18: =E18*30/105 -> 16.142857142857142
A19: 18 | B19: 44222008 | C19: นางสาวอิงครัต สุขาบูรณ์ | D19: T04 | E19: 76.5 | F19: =E19*30/105 -> 21.857142857142858
A20: 19 | B20: 45220605 | C20: นายณรงค์ศักดิ์ แซ่ตั๊น | D20: T04 | E20: 42 | F20: =E20*30/105 -> 12.00
A21: 20 | B21: 45220761 | C21: นายดุษฎี ประกายมรมาศ | D21: T04 | E21: 63.5 | F21: =E21*30/105 -> 18.142857142857142
A22: 21 | B22: 45220951 | C22: นางสาวธัญกมล มีเพียร | D22: T04 | E22: 65 | F22: =E22*30/105 -> 18.571428571428573
A23: 22 | B23: 45221710 | C23: นายภานุวัฒน์ บุญเรือง | D23: T04 | E23: 63.5 | F23: =E23*30/105 -> 18.142857142857142
A24: 23 | B24: 45222627 | C24: นายสิทธิชัย สุนิพัฒน์ | D24: T04 | E24: 46 | F24: =E24*30/105 -> 13.142857142857142
A25: 24 | B25: 45222924 | C25: นายอภิชาติ จงเทพ | D25: T04 | E25: 50 | F25: =E25*30/105 -> 14.285714285714286
B27: avg | E27: =AVERAGE(E2:E24) -> 56.152173913043477 | F27: =AVERAGE(F2:F24) -> 16.043478260869566